{
  "$schema": "https://json-schema.org/draft/2020-12/schema",
  "$id": "https://vexil-lang.org/release/exercises/tabletop-stewardship-continuity-2026-07-14.json",
  "exerciseSchema": "https://vexil-lang.org/release/schemas/stewardship-exercise.schema.json",
  "version": "1.0",
  "recordId": "STE-2026-07-14-01",
  "kind": "tabletop-stewardship-continuity",
  "mode": "tabletop-only-non-mutating",
  "exercisedAtUtc": "2026-07-14T18:00:00Z",
  "participants": [
    {"actorId": "github:furkanmamuk", "assertedRole": "repository-administrator", "assignmentId": "assignment-repository-administrator-2026-07-14"},
    {"actorId": "github:furkanmamuk", "assertedRole": "release-steward", "assignmentId": "assignment-release-steward-2026-07-14"}
  ],
  "scenarios": [
    {"id": "STE-SCENARIO-001", "scenario": "unavailable-owner", "affectedAuthority": "release-steward", "procedureId": "release-continuity-runbook", "allowedActions": ["stop", "contain", "activate-succession"], "prohibitedActions": ["approve-release-manifest", "authorize-privileged-release", "approve-publication", "move-tag", "rewrite-evidence", "declare-completion"], "providerBlockers": [{"control": "GitHub repository administrator succession and protected-identity control", "status": "unverified-external-control-blocker", "requiredEvidence": "Verified repository-control evidence"}], "observedGaps": ["No distinct non-publishing recovery custodian is assigned."], "followUpOwner": {"actorId": "github:furkanmamuk", "assertedRole": "repository-administrator", "assignmentId": "assignment-repository-administrator-2026-07-14"}, "disposition": "blocked-pending-external-controls"},
    {"id": "STE-SCENARIO-002", "scenario": "suspected-credential-or-automation-compromise", "affectedAuthority": "repository-administrator", "procedureId": "emergency-stop-runbook", "allowedActions": ["stop", "revoke", "contain"], "prohibitedActions": ["publish-package", "deploy", "move-tag", "overwrite-artifact", "rewrite-evidence", "approve-publication", "declare-completion"], "providerBlockers": [{"control": "GitHub Actions workflow, github-pages environment, GitHub Actions release identity, and npm trusted-publishing identity", "status": "unverified-external-control-blocker", "requiredEvidence": "Verified workflow, environment, identity, and revocation-control evidence"}], "observedGaps": ["The exercise identifies controls but does not verify provider-side stop or revocation capability."], "followUpOwner": {"actorId": "github:furkanmamuk", "assertedRole": "repository-administrator", "assignmentId": "assignment-repository-administrator-2026-07-14"}, "disposition": "blocked-pending-external-controls"},
    {"id": "STE-SCENARIO-003", "scenario": "advisory-failure", "affectedAuthority": "release-run-coordinator", "procedureId": "advisory-manual-fallback-runbook", "allowedActions": ["perform-manually", "defer"], "prohibitedActions": ["authorize-privileged-release", "approve-publication", "publish-package", "deploy", "accept-security-risk", "rewrite-evidence", "declare-completion"], "providerBlockers": [{"control": "Advisory automation identity and minimum-permission verification", "status": "unverified-external-control-blocker", "requiredEvidence": "Verified advisory identity and access evidence"}], "observedGaps": ["Manual fallback records a public audit entry but has no privileged authority."], "followUpOwner": {"actorId": "github:furkanmamuk", "assertedRole": "repository-administrator", "assignmentId": "assignment-repository-administrator-2026-07-14"}, "disposition": "blocked-pending-external-controls"},
    {"id": "STE-SCENARIO-004", "scenario": "missing-provider-control", "affectedAuthority": "repository-administrator", "procedureId": "trust-revocation-runbook", "allowedActions": ["stop", "revoke", "contain", "activate-succession"], "prohibitedActions": ["create-release", "publish-package", "deploy", "approve-publication", "rewrite-evidence", "declare-completion"], "providerBlockers": [{"control": "GitHub Actions and package-registry trust revocation controls", "status": "unverified-external-control-blocker", "requiredEvidence": "Verified provider-control and custody evidence"}], "observedGaps": ["Provider-specific revocation remains untested and cannot be reported compliant."], "followUpOwner": {"actorId": "github:furkanmamuk", "assertedRole": "repository-administrator", "assignmentId": "assignment-repository-administrator-2026-07-14"}, "disposition": "blocked-pending-external-controls"}
  ],
  "evidence": {"destination": "release/exercises/tabletop-stewardship-continuity-2026-07-14.json", "persistence": "version-controlled-public-record", "secretsIncluded": false}
}
